{"$schema":"https://json-schema.org/draft/2020-12/schema","$id":"question-bank-v3/release-manifest.v3.3.schema.json","type":"object","additionalProperties":false,"required":["schemaVersion","scope","categoryIds","scopeHash"],"properties":{"schemaVersion":{"const":"3.3.0"},"scope":{"const":"question-bank-v3.3-runtime-62"},"categoryIds":{"type":"array","minItems":62,"maxItems":62,"uniqueItems":true,"items":{"pattern":"^tahadani-(0[0-5][0-9]|06[0-2])$"}},"scopeHash":{"pattern":"^[a-f0-9]{64}$"}}}
