{"categoryIds":["tahadani-001","tahadani-002","tahadani-003","tahadani-004","tahadani-005","tahadani-006","tahadani-007","tahadani-008","tahadani-009","tahadani-010","tahadani-011","tahadani-012","tahadani-013","tahadani-014","tahadani-015","tahadani-016","tahadani-017","tahadani-018","tahadani-019","tahadani-020","tahadani-021","tahadani-022","tahadani-023","tahadani-024","tahadani-025","tahadani-026","tahadani-027","tahadani-028","tahadani-029","tahadani-030","tahadani-031","tahadani-032","tahadani-033","tahadani-034","tahadani-035","tahadani-036","tahadani-037","tahadani-038","tahadani-039","tahadani-040","tahadani-041","tahadani-042","tahadani-043","tahadani-044","tahadani-045","tahadani-046","tahadani-047","tahadani-048","tahadani-049","tahadani-050","tahadani-051","tahadani-052","tahadani-053","tahadani-054","tahadani-055","tahadani-056","tahadani-057","tahadani-058","tahadani-059","tahadani-060","tahadani-061","tahadani-062"],"schemaVersion":"3.3.0","scope":"question-bank-v3.3-runtime-62","scopeHash":"e4efbac6dec68d23ce69ff626cff7f976e1407d549939e962a7f4cbbcd3a9ab2"}
